"Interview with Shuah Khan, Kernel Maintainer & Linux Fellow",https://www.linux.com/news/interview-with-shuah-khan-kernel-maintainer-linux-fellow/
How to automate system reboots using the Ansible reboot module,https://www.linux.com/news/how-to-automate-system-reboots-using-the-ansible-reboot-module/
It’s the season for sysadmin reading,https://www.linux.com/news/its-the-season-for-sysadmin-reading/
Distributed Identity Foundation (DIF) January 2021 Highlights,https://www.linux.com/news/distributed-identity-foundation-dif-january-2021-highlights/
Getting started with SystemTap on Oracle Linux,https://www.linux.com/news/getting-started-with-systemtap-on-oracle-linux/
Best practices for adapting Phoronix Test Suite to benchmark Linux performance,https://www.linux.com/news/best-practices-for-adapting-phoronix-test-suite-to-benchmark-linux-performance/
"Interview with Shuah Khan, Kernel Maintainer & Linux Fellow",https://www.linux.com/news/interview-with-shuah-khan-kernel-maintainer-linux-fellow/
Anticipating Your Memory Needs,https://www.linux.com/news/anticipating-your-memory-needs/
Open Source Security Foundation (OpenSSF): Reflection and Future,https://www.linux.com/news/open-source-security-foundation-openssf-reflection-and-future/
Enumerating a new network with Nmap,https://www.linux.com/news/enumerating-a-new-network-with-nmap/
Open Source Security Foundation (OpenSSF): Reflection and Future,https://www.linux.com/news/open-source-security-foundation-openssf-reflection-and-future/
How to change the identity of a Linux system,https://www.linux.com/news/how-to-change-the-identity-of-a-linux-system/
Distributed Identity Foundation (DIF) January 2021 Highlights,https://www.linux.com/news/distributed-identity-foundation-dif-january-2021-highlights/
"Blacks In Technology and The Linux Foundation Partner to Offer up to $100,000 in Training & Certification to Deserving Individuals",https://www.linux.com/news/blacks-in-technology-and-the-linux-foundation-partner-to-offer-up-to-100000-in-training-certification-to-deserving-individuals/
"January 2021 Linux Foundation Newsletter: Bootcamp Sale, SolarWinds Orion, New Kubernetes & WebAssembly Classes, LFX Webinar Series",https://www.linux.com/news/january-2021-linux-foundation-newsletter-bootcamp-sale-solarwinds-orion-new-kubernetes-webassembly-classes-lfx-webinar-series/
Instructor-Led Kubernetes Security Fundamentals Course Now Available,https://www.linux.com/news/instructor-led-kubernetes-security-fundamentals-course-now-available/
"Interview with Shuah Khan, Kernel Maintainer & Linux Fellow",https://www.linux.com/news/interview-with-shuah-khan-kernel-maintainer-linux-fellow/
Linux Foundation Public Health Joins The Fight Against COVID-19 Pandemic,https://www.linux.com/featured/linux-foundation-public-health-joins-the-fight-against-covid-19-pandemic/
Start 2021 Off With a New Career in the Cloud! Cloud Engineering Bootcamps are on Sale,https://www.linux.com/news/start-2021-off-with-a-new-career-in-the-cloud-cloud-engineering-bootcamps-are-on-sale/
Preventing Supply Chain Attacks like SolarWinds,https://www.linux.com/news/preventing-supply-chain-attacks-like-solarwinds/
Open Source Management & Strategy Training Program Launched by The Linux Foundation,https://www.linux.com/news/open-source-management-strategy-training-program-launched-by-the-linux-foundation/
Best practices for adapting Phoronix Test Suite to benchmark Linux performance,https://www.linux.com/news/best-practices-for-adapting-phoronix-test-suite-to-benchmark-linux-performance/
It’s the season for sysadmin reading,https://www.linux.com/news/its-the-season-for-sysadmin-reading/
Enumerating a new network with Nmap,https://www.linux.com/news/enumerating-a-new-network-with-nmap/
How to automate system reboots using the Ansible reboot module,https://www.linux.com/news/how-to-automate-system-reboots-using-the-ansible-reboot-module/
Anticipating Your Memory Needs,https://www.linux.com/news/anticipating-your-memory-needs/
How to change the identity of a Linux system,https://www.linux.com/news/how-to-change-the-identity-of-a-linux-system/
5 questions to ask during your next sysadmin interview,https://www.linux.com/news/5-questions-to-ask-during-your-next-sysadmin-interview/
Getting started with SystemTap on Oracle Linux,https://www.linux.com/news/getting-started-with-systemtap-on-oracle-linux/
How to replay terminal sessions recorded with the Linux script command,https://www.linux.com/news/how-to-replay-terminal-sessions-recorded-with-the-linux-script-command/
Quick start guide to Ansible for Linux sysadmins,https://www.linux.com/news/quick-start-guide-to-ansible-for-linux-sysadmins/
